{
  "schema_version": "zentinel.doctest.report.v1",
  "run": {
    "id": "doctest_mutation_run",
    "status": "completed",
    "error": null,
    "zentinel_version": "0.0.0",
    "zig_version": "0.16.0",
    "command": "zentinel doctest --mutate",
    "project_root": "<project>",
    "started_at": "1970-01-01T00:00:00Z",
    "duration_ms": 0
  },
  "summary": {
    "total": 0,
    "passed": 0,
    "failed": 0,
    "compile_error": 0,
    "expected_compile_error": 0,
    "timeout": 0,
    "skipped": 0,
    "invalid": 0,
    "mutation": {
      "total": 3,
      "killed": 0,
      "survived": 3,
      "compile_error": 0,
      "compiler_crash": 0,
      "timeout": 0,
      "skipped": 0,
      "invalid": 0
    }
  },
  "cases": [
    {
      "id": "dm_162nqd3by3svf1za4wftnkzy2w",
      "file": "docs/survived.md",
      "line_start": 5,
      "line_end": 15,
      "source_ref": "docs/survived.md:5",
      "block_refs": [
        "docs/survived.md:5"
      ],
      "kind": "mutation",
      "status": "survived",
      "expectation": null,
      "command": null,
      "result": null,
      "diagnostics": [],
      "advisory": {
        "ai": null
      },
      "mutation": {
        "doctest_case_id": "dt_3h51e3pehabwywr7hv6fsryqdy",
        "mutant_id": "m_8gjkdzyacjhze4s5smk9mbbgmr",
        "operator": "comparison_boundary",
        "operator_stability": "stable",
        "backend": "ast",
        "backend_stability": "stable",
        "doc_file": "docs/survived.md",
        "doc_line": 5,
        "source_ref": "docs/survived.md:5",
        "mutated_diff": [
          "- >=",
          "+ >"
        ],
        "survivor_ref": "ds_2xxh4aj0c4vxrpnzr204z062ep",
        "runner_evidence": {
          "status": "survived",
          "command": {
            "original": "zig test src/doctest.zig",
            "argv": [
              "zig",
              "test",
              "src/doctest.zig"
            ],
            "cwd": ".",
            "environment_policy": "minimal",
            "shell": false
          },
          "exit_code": 0,
          "timed_out": false,
          "failure_kind": "none",
          "stdout_excerpt": "",
          "stderr_excerpt": "",
          "failure_summary": "",
          "skip_reason": null
        }
      }
    },
    {
      "id": "dm_c0t3agdetrmy94xjs97e7ajc6s",
      "file": "docs/survived.md",
      "line_start": 5,
      "line_end": 15,
      "source_ref": "docs/survived.md:5",
      "block_refs": [
        "docs/survived.md:5"
      ],
      "kind": "mutation",
      "status": "survived",
      "expectation": null,
      "command": null,
      "result": null,
      "diagnostics": [],
      "advisory": {
        "ai": null
      },
      "mutation": {
        "doctest_case_id": "dt_3h51e3pehabwywr7hv6fsryqdy",
        "mutant_id": "m_hds56dd4f1cjphfwyk4kn9me3d",
        "operator": "integer_literal_boundary",
        "operator_stability": "stable",
        "backend": "ast",
        "backend_stability": "stable",
        "doc_file": "docs/survived.md",
        "doc_line": 5,
        "source_ref": "docs/survived.md:5",
        "mutated_diff": [
          "- 0",
          "+ 1"
        ],
        "survivor_ref": "ds_ezmck61kg0r9zdzexr2eqnvv6z",
        "runner_evidence": {
          "status": "survived",
          "command": {
            "original": "zig test src/doctest.zig",
            "argv": [
              "zig",
              "test",
              "src/doctest.zig"
            ],
            "cwd": ".",
            "environment_policy": "minimal",
            "shell": false
          },
          "exit_code": 0,
          "timed_out": false,
          "failure_kind": "none",
          "stdout_excerpt": "",
          "stderr_excerpt": "",
          "failure_summary": "",
          "skip_reason": null
        }
      }
    },
    {
      "id": "dm_v2cxwy6rjmxsg87q37r9at4peq",
      "file": "docs/survived.md",
      "line_start": 5,
      "line_end": 15,
      "source_ref": "docs/survived.md:5",
      "block_refs": [
        "docs/survived.md:5"
      ],
      "kind": "mutation",
      "status": "survived",
      "expectation": null,
      "command": null,
      "result": null,
      "diagnostics": [],
      "advisory": {
        "ai": null
      },
      "mutation": {
        "doctest_case_id": "dt_3h51e3pehabwywr7hv6fsryqdy",
        "mutant_id": "m_877cp6wdhan1rx8z92py004zz8",
        "operator": "integer_literal_boundary",
        "operator_stability": "stable",
        "backend": "ast",
        "backend_stability": "stable",
        "doc_file": "docs/survived.md",
        "doc_line": 5,
        "source_ref": "docs/survived.md:5",
        "mutated_diff": [
          "- 0",
          "+ -1"
        ],
        "survivor_ref": "ds_sg291nyzkcaf6g49y3ng84wgvr",
        "runner_evidence": {
          "status": "survived",
          "command": {
            "original": "zig test src/doctest.zig",
            "argv": [
              "zig",
              "test",
              "src/doctest.zig"
            ],
            "cwd": ".",
            "environment_policy": "minimal",
            "shell": false
          },
          "exit_code": 0,
          "timed_out": false,
          "failure_kind": "none",
          "stdout_excerpt": "",
          "stderr_excerpt": "",
          "failure_summary": "",
          "skip_reason": null
        }
      }
    }
  ]
}
